{
  "office": "Proposition 5",
  "district": "Changes Recall Election Process for Statewide Officers.",
  "division": "ca/state",
  "kind": "measure",
  "summary": "A Yes vote removes the successor-election question from statewide recall elections and provides for filling a resulting vacancy under constitutional and statutory procedures.",
  "issues": [],
  "choices": [
    {
      "name": "Yes",
      "stances": {}
    },
    {
      "name": "No",
      "stances": {}
    }
  ],
  "checkedAt": "2026-09-25",
  "reviewed": false
}
