{
  "office": "Measure O",
  "district": "City of McFarland",
  "division": "ca/place-mcfarland",
  "kind": "measure",
  "summary": "A Yes vote enacts city regulations prohibiting concentrated animal feeding operations (CAFOs) in McFarland.",
  "issues": [],
  "choices": [
    {
      "name": "Yes",
      "stances": {}
    },
    {
      "name": "No",
      "stances": {}
    }
  ],
  "checkedAt": "2026-09-25",
  "reviewed": false
}
