{
  "office": "State Assembly",
  "district": "California Assembly District 15",
  "division": "ca/sldl-15",
  "kind": "candidate",
  "issues": [
    "tax",
    "wages",
    "housing",
    "schools",
    "safety",
    "sentencing",
    "immigration",
    "guns",
    "abortion",
    "gender",
    "cannabis",
    "health",
    "energy",
    "voting"
  ],
  "choices": [
    {
      "name": "Anamarie Avila Farias",
      "party": "Democratic",
      "stances": {
        "housing": {
          "toward": "building more housing",
          "strength": "lean",
          "text": "On her campaign site she calls housing a basic human right and prioritizes expanding affordable and permanent housing, and as an Assemblymember she has authored bills to boost housing production.",
          "quote": "Safe and affordable housing is a basic human right.",
          "sourceUrl": "https://anamarieforassembly.com/top-legislative-priorities/",
          "agreement": "5/8"
        },
        "schools": {
          "toward": "district public schools",
          "strength": "lean",
          "text": "Her platform prioritizes increased and equitable funding for public school districts and reducing overcrowding rather than school choice or vouchers.",
          "quote": "We must acknowledge and address overcrowding in schools and make funding schools a priority while investing fully and equitably in students.",
          "sourceUrl": "https://anamarieforassembly.com/top-legislative-priorities/",
          "agreement": "6/8"
        },
        "abortion": {
          "toward": "protecting access",
          "strength": "strong",
          "text": "After Roe v. Wade was overturned she publicly decried the loss of abortion rights and called for a protest boycott.",
          "quote": "Lastly, last Friday women's reproductive rights were taken away!",
          "sourceUrl": "https://www.foxnews.com/politics/california-school-board-member-calls-boycott-july-4th",
          "agreement": "5/8"
        },
        "energy": {
          "toward": "faster emissions cuts",
          "strength": "strong",
          "text": "Her platform states California should lead in reaching net-zero greenhouse gas emissions and reducing carbon pollution, and she earned a 76% environmental voting score in 2025.",
          "quote": "California must lead in being a net zero greenhouse gas emission state.",
          "sourceUrl": "https://anamarieforassembly.com/top-legislative-priorities/",
          "agreement": "8/8"
        }
      }
    },
    {
      "name": "Arthur Webb",
      "party": "No Party Preference",
      "stances": {
        "tax": {
          "toward": "lower taxes",
          "strength": "strong",
          "text": "Webb pledges to oppose every proposed tax increase and says California should reduce spending instead.",
          "quote": "I will vote against every proposed tax increase. We have a spending problem, not a revenue problem.",
          "sourceUrl": "https://www.arthurwebbassembly.com/why-i-am-running",
          "agreement": "8/10"
        },
        "housing": {
          "toward": "building more housing",
          "strength": "lean",
          "text": "Webb advocates reducing regulatory barriers to housing and supports placing time limits on environmental reviews to advance new projects.",
          "quote": "This Proposition will end the permanent pocket veto of housing projects by individuals in public agencies. One year is plenty long enough for due diligence in environmental impact reviews. This Proposition will promote housing in California.",
          "sourceUrl": "https://www.arthurwebbassembly.com/propositions",
          "agreement": "4/10"
        },
        "energy": {
          "toward": "cheaper energy",
          "strength": "strong",
          "text": "Webb wants to drop gas and diesel excise taxes and eliminate cap-and-trade and California's special fuel blend to lower energy costs.",
          "quote": "Gas excise taxes and diesel excise taxes should be dropped as too regressive.",
          "sourceUrl": "https://www.arthurwebbassembly.com/issues",
          "agreement": "7/10"
        },
        "voting": {
          "toward": "tighter rules",
          "strength": "strong",
          "text": "Webb calls for a state voter ID law, regular voter-roll maintenance, and paper ballots with audits.",
          "quote": "California should enact its own voter ID law before the federal government imposes one on us.",
          "sourceUrl": "https://www.arthurwebbassembly.com/why-i-am-running",
          "agreement": "5/10"
        }
      }
    }
  ],
  "sources": "anamarieforassembly.com · foxnews.com · arthurwebbassembly.com",
  "checkedAt": "2026-09-24",
  "reviewed": false
}
