{
  "office": "Proposition 1",
  "district": "Authorizes Bonds for Housing Affordability Programs.",
  "division": "ca/state",
  "kind": "measure",
  "summary": "A Yes vote allows the state to borrow $11.25 billion for veterans' housing and housing-affordability programs.",
  "issues": [],
  "choices": [
    {
      "name": "Yes",
      "stances": {}
    },
    {
      "name": "No",
      "stances": {}
    }
  ],
  "checkedAt": "2026-09-25",
  "reviewed": false
}
