{
  "office": "Measure A",
  "district": "City of Roseville",
  "division": "ca/place-roseville",
  "kind": "measure",
  "summary": "A Yes vote amends the City of Roseville charter to change councilmember compensation from $600 per month to $2,550 per month, with annual inflation adjustments not to exceed 5%.",
  "issues": [],
  "choices": [
    {
      "name": "Yes",
      "stances": {}
    },
    {
      "name": "No",
      "stances": {}
    }
  ],
  "checkedAt": "2026-09-25",
  "reviewed": false
}
