{
  "office": "State Assembly",
  "district": "CA District 27",
  "division": "ca/sldl-27",
  "kind": "candidate",
  "issues": [
    "tax",
    "wages",
    "housing",
    "schools",
    "safety",
    "sentencing",
    "immigration",
    "guns",
    "abortion",
    "gender",
    "cannabis",
    "health",
    "energy",
    "voting"
  ],
  "choices": [
    {
      "name": "Brian Pacheco",
      "party": "Democratic",
      "stances": {
        "tax": {
          "toward": "lower taxes",
          "strength": "strong",
          "text": "Pacheco says he will fight to lower prices and stop tax increases on the middle class, and opposes new taxes on gas and groceries.",
          "quote": "He will fight to lower prices, stop tax increases on the middle class, and push back against tariffs that drive up costs for working families.",
          "sourceUrl": "https://www.pachecoforca.com/",
          "agreement": "5/5"
        },
        "housing": {
          "toward": "building more housing",
          "strength": "lean",
          "text": "Pacheco says he is committed to building more affordable housing so families can afford to stay in their homes.",
          "quote": "He's committed to fixing California's broken home insurance system and building more affordable housing so families can afford to stay in their homes.",
          "sourceUrl": "https://www.pachecoforca.com/issues",
          "agreement": "5/5"
        },
        "safety": {
          "toward": "more enforcement",
          "strength": "lean",
          "text": "As county supervisor Pacheco directed funding to police and campaigns on securing public safety funding.",
          "quote": "As County Supervisor, Brian delivered $100 million to protect our water, fix roads, and fund police.",
          "sourceUrl": "https://www.pachecoforca.com/issues",
          "agreement": "5/5"
        }
      }
    },
    {
      "name": "Mike Murphy",
      "party": "Republican",
      "stances": {
        "tax": {
          "toward": "lower taxes",
          "strength": "lean",
          "text": "Murphy says he would cut the gas tax and roll back regulations to lower fuel prices.",
          "quote": "I'll vote to lower gas and diesel prices by cutting the gas tax and rolling back the regulations that drive up costs at the pump.",
          "sourceUrl": "https://mikemurphy4assembly.com/issues",
          "agreement": "4/5"
        },
        "safety": {
          "toward": "more enforcement",
          "strength": "strong",
          "text": "Murphy supports additional police officers, proactive police action, and protecting dedicated public-safety funding.",
          "quote": "Supports additional sworn police officers annually, policies enabling proactive officer action, and new technology assisting law enforcement.",
          "sourceUrl": "https://www.change.vote/candidacy/mike-murphy.EMZ6Po25",
          "agreement": "3/5"
        },
        "sentencing": {
          "toward": "tougher sentences",
          "strength": "strong",
          "text": "Murphy says the legislature has not adequately funded Proposition 36 and that he would fund it.",
          "quote": "The legislature hasn't adequately funded Proposition 36. I will.",
          "sourceUrl": "https://mikemurphy4assembly.com/issues",
          "agreement": "4/5"
        },
        "immigration": {
          "toward": "more legal pathways",
          "strength": "lean",
          "text": "Murphy says immigration policy should be orderly and compassionate and should not focus on nonfelons who are working and supporting agriculture.",
          "quote": "we need to be focused at the local level, local enforcement of local issues and not get caught up with the folks who are not felons, who are here trying to make a living and supporting our farms.",
          "sourceUrl": "https://themercedfocus.org/27thassemblydebate/",
          "agreement": "3/5"
        }
      }
    }
  ],
  "sources": "pachecoforca.com · mikemurphy4assembly.com · change.vote · themercedfocus.org",
  "checkedAt": "2026-09-25",
  "reviewed": false
}
