{
  "office": "Measure E",
  "district": "Tehama County",
  "division": "ca/county-tehama",
  "kind": "measure",
  "summary": "A Yes vote amends the county charter to set each Board of Supervisors member's annual salary at the California minimum wage multiplied by 2,080 hours, adjusting automatically as the minimum wage changes.",
  "issues": [],
  "choices": [
    {
      "name": "Yes",
      "stances": {}
    },
    {
      "name": "No",
      "stances": {}
    }
  ],
  "checkedAt": "2026-09-25",
  "reviewed": false
}
