{
  "office": "U.S. Representative",
  "district": "CA District 46",
  "division": "ca/cd-46",
  "kind": "candidate",
  "issues": [
    "tax",
    "wages",
    "trade",
    "debt",
    "housing",
    "schools",
    "safety",
    "immigration",
    "guns",
    "abortion",
    "gender",
    "cannabis",
    "health",
    "energy",
    "voting"
  ],
  "choices": [
    {
      "name": "Lou Correa",
      "party": "Democratic",
      "stances": {
        "trade": {
          "toward": "freer trade",
          "strength": "lean",
          "text": "Released a report criticizing President Trump’s tariff taxes for raising costs for families.",
          "quote": "detailing how President Trump's tariff taxes, his war with Iran, and his so-called \"Big Beautiful Bill\" are driving up costs",
          "sourceUrl": "https://correa.house.gov/news/press-releases/correa-releases-report-on-the-trump-cost-of-living-crisis",
          "agreement": "8/10"
        },
        "schools": {
          "toward": "district public schools",
          "strength": "lean",
          "text": "Voted for a funding bill that temporarily blocked efforts to strip federal funding from schools.",
          "quote": "this bill does not include a backdoor to fund Border Patrol. It also temporarily blocks the White House Office of Management and Budget’s push to strip federal funding from schools and hospitals",
          "sourceUrl": "https://correa.house.gov/news/press-releases/correa-bipartisan-deal-keeps-government-open-without-funding-border-patrol",
          "agreement": "8/10"
        },
        "safety": {
          "toward": "more enforcement",
          "strength": "lean",
          "text": "Secured federal funding for Santa Ana College’s criminal justice academies to train correctional and peace officers.",
          "quote": "$1,031,000 in FY26 for the college’s Criminal Justice Academies to enhance regional training programs and facilities to meet the current and future demand for correctional and peace officers.",
          "sourceUrl": "https://correa.house.gov/news/press-releases/correa-secures-850000-in-federal-funding-for-santa-ana-college-workforce-training-programs",
          "agreement": "5/10"
        },
        "immigration": {
          "toward": "more legal pathways",
          "strength": "lean",
          "text": "Introduced legislation to create optional expedited processing for employment-based permanent labor certifications used in green-card applications.",
          "quote": "This bill gives the Department of Labor the resources to modernize the PERM process, reduce delays, and make sure our system works for employers, workers, and America's economy.",
          "sourceUrl": "https://correa.house.gov/news/press-releases/correa-grothman-introduce-perm-backlog-reduction-act-to-address-green-card-processing-delays",
          "agreement": "6/10"
        },
        "health": {
          "toward": "public coverage",
          "strength": "lean",
          "text": "Released a report warning that cuts to Medicaid and the Affordable Care Act could cause people to lose coverage and raise premiums.",
          "quote": "An estimated 54,370 people in CA-46 are at risk of losing health coverage because of Trump's cuts to Medicaid and the ACA, and 27,000 more are paying higher premiums after Trump allowed enhanced ACA tax credits to expire.",
          "sourceUrl": "https://correa.house.gov/news/press-releases/correa-releases-report-on-the-trump-cost-of-living-crisis",
          "agreement": "9/10"
        },
        "voting": {
          "toward": "easier voting",
          "strength": "strong",
          "text": "Voted against a resolution supporting the SAVE America Act and said it would create barriers to voter registration and voting.",
          "quote": "I won’t vote for any bill that makes it harder for the people who defend this country to exercise their right to vote.",
          "sourceUrl": "https://correa.house.gov/news/press-releases/correa-opposes-gop-voter-suppression-efforts-again",
          "agreement": "10/10"
        }
      }
    },
    {
      "name": "David Pan",
      "party": "Republican",
      "stances": {
        "tax": {
          "toward": "lower taxes",
          "strength": "strong",
          "text": "Pan proposes reducing government spending and the size of government in order to reduce taxes.",
          "quote": "My first priorities are to reduce the size and scope of government in order to reduce taxes.",
          "sourceUrl": "https://www.davidpan4congress.com/blog/reforming-social-security-to-guarantee-benefits-into-the-future",
          "agreement": "9/9"
        },
        "wages": {
          "toward": "market-set wages",
          "strength": "strong",
          "text": "Pan says minimum-wage increases reduce jobs and supports raising worker pay through lower taxes instead.",
          "quote": "We need to support free markets. Laws that keep prices down usually have unintended consequences.",
          "sourceUrl": "https://www.davidpan4congress.com/blog/free-markets-or-government-control",
          "agreement": "7/9"
        },
        "trade": {
          "toward": "neither side",
          "strength": "lean",
          "text": "Pan supports targeted tariffs against unfair foreign subsidies but opposes blanket tariffs.",
          "quote": "It is appropriate to apply tariffs when other countries unfairly subsidize their own industries",
          "sourceUrl": "https://www.davidpan4congress.com/blog/free-markets-or-government-control",
          "agreement": "4/9"
        },
        "debt": {
          "toward": "neither side",
          "strength": "lean",
          "text": "Pan proposes reducing national debt while preserving existing Social Security and Medicare benefits for older people and changing the system for younger people.",
          "quote": "It will guarantee current benefit levels for all retirees as well as anyone age 37 and over by changing the system for those under 37.",
          "sourceUrl": "https://www.davidpan4congress.com/blog/reforming-social-security-to-guarantee-benefits-into-the-future",
          "agreement": "5/9"
        },
        "schools": {
          "toward": "school choice",
          "strength": "strong",
          "text": "Pan supports charter schools and vouchers to give parents more educational options.",
          "quote": "I support school choice, which would allow parents to move their children to the best schools to meet their children’s needs.",
          "sourceUrl": "https://www.davidpan4congress.com/blog/helping-our-immigrants-by-creating-opportunities",
          "agreement": "9/9"
        },
        "safety": {
          "toward": "more enforcement",
          "strength": "strong",
          "text": "Pan says police should receive the resources and legal support needed to protect people and property and that laws should be enforced.",
          "quote": "I will work to ensure our police officers have the resources and legal support they need to protect our lives and property.",
          "sourceUrl": "https://www.davidpan4congress.com/blog/a-new-approach-to-public-safety",
          "agreement": "9/9"
        },
        "immigration": {
          "toward": "stricter enforcement",
          "strength": "lean",
          "text": "Pan says public safety requires enforcing laws and maintaining secure borders while describing opportunities for immigrants.",
          "quote": "Pan is running to ensure public safety, maintain secure borders, empower school parents, transform welfare, and reduce the size and scope of government .",
          "sourceUrl": "https://natlawreview.com/press-releases/republican-david-pan-accelerates-drive-congress-ca-46",
          "agreement": "4/9"
        },
        "health": {
          "toward": "private insurance",
          "strength": "strong",
          "text": "Pan proposes replacing much of the existing entitlement system with a health-insurance voucher used on the private market.",
          "quote": "The money would consist of $1000 per month as a direct deposit into each individual’s bank account and $4000 per year as a health insurance voucher to be used on the private market.",
          "sourceUrl": "https://www.davidpan4congress.com/blog/how-to-receive-16000-per-year-for-life",
          "agreement": "5/9"
        }
      }
    }
  ],
  "sources": "correa.house.gov · davidpan4congress.com · natlawreview.com",
  "checkedAt": "2026-09-24",
  "reviewed": false
}
