{
  "office": "Measure E",
  "district": "City of Mountain View",
  "division": "ca/place-mountain-view",
  "kind": "measure",
  "summary": "A Yes vote amends the city charter to replace gender-specific terms with gender-neutral language and update certain procedures.",
  "issues": [],
  "choices": [
    {
      "name": "Yes",
      "stances": {}
    },
    {
      "name": "No",
      "stances": {}
    }
  ],
  "checkedAt": "2026-09-25",
  "reviewed": false
}
